{
  "$schema": "https://json-schema.org/draft/2020-12/schema",
  "title": "model-gate configuration v1",
  "type": "object",
  "required": [
    "version",
    "backends"
  ],
  "additionalProperties": false,
  "properties": {
    "version": {
      "enum": [
        1
      ]
    },
    "listen": {
      "type": "string",
      "minLength": 1
    },
    "auto_model": {
      "type": "string",
      "minLength": 1
    },
    "memory_profile_gb": {
      "type": "integer",
      "minimum": 1
    },
    "require_unload": {
      "type": "boolean"
    },
    "lifecycle_timeout": {
      "type": "number",
      "exclusiveMinimum": 0
    },
    "upstream_timeout": {
      "type": "number",
      "exclusiveMinimum": 0
    },
    "queue_timeout": {
      "type": "number",
      "exclusiveMinimum": 0
    },
    "lifecycle_failure_cooldown": {
      "type": "number",
      "minimum": 0
    },
    "max_body_bytes": {
      "type": "integer",
      "minimum": 1
    },
    "model_discovery_timeout": {
      "type": "number",
      "exclusiveMinimum": 0
    },
    "$schema": {
      "type": "string",
      "minLength": 1
    },
    "backends": {
      "type": "object",
      "minProperties": 1,
      "additionalProperties": {
        "oneOf": [
          {
            "type": "object",
            "required": [
              "type",
              "binary",
              "models"
            ],
            "properties": {
              "max_concurrency": {
                "type": "integer",
                "minimum": 1
              },
              "prefixes": {
                "type": "array",
                "items": {
                  "type": "string",
                  "minLength": 1
                }
              },
              "discover_models": {
                "type": "boolean"
              },
              "model_list_path": {
                "type": "string",
                "minLength": 1
              },
              "load_url": {
                "type": "string",
                "minLength": 1
              },
              "unload_url": {
                "type": "string",
                "minLength": 1
              },
              "unload_all_url": {
                "type": "string",
                "minLength": 1
              },
              "requires_unload": {
                "type": "boolean"
              },
              "ready_path": {
                "type": "string",
                "minLength": 1
              },
              "model_status_path": {
                "type": [
                  "string",
                  "null"
                ]
              },
              "inject_stream_usage": {
                "type": "boolean"
              },
              "startup_timeout": {
                "type": "number",
                "exclusiveMinimum": 0
              },
              "startup_poll_seconds": {
                "type": "number",
                "exclusiveMinimum": 0
              },
              "unload_timeout": {
                "type": "number",
                "exclusiveMinimum": 0
              },
              "settle_seconds": {
                "type": "number",
                "minimum": 0
              },
              "unload_settle_seconds": {
                "type": "number",
                "minimum": 0
              },
              "load_settle_seconds": {
                "type": "number",
                "minimum": 0
              },
              "model_policies": {
                "type": "object",
                "additionalProperties": {
                  "type": "object",
                  "required": [
                    "max_concurrency"
                  ],
                  "additionalProperties": false,
                  "properties": {
                    "max_concurrency": {
                      "type": "integer",
                      "minimum": 1
                    }
                  }
                }
              },
              "type": {
                "enum": [
                  "ds4"
                ]
              },
              "port": {
                "oneOf": [
                  {
                    "enum": [
                      "auto"
                    ]
                  },
                  {
                    "type": "integer",
                    "minimum": 1,
                    "maximum": 65535
                  }
                ]
              },
              "working_dir": {
                "type": "string",
                "minLength": 1
              },
              "env": {
                "type": "object",
                "additionalProperties": {
                  "type": "string"
                }
              },
              "command": {
                "type": "array",
                "items": {
                  "type": "string",
                  "minLength": 1
                }
              },
              "model_commands": {
                "type": "object",
                "additionalProperties": {
                  "type": "array",
                  "items": {
                    "type": "string",
                    "minLength": 1
                  }
                }
              },
              "binary": {
                "type": "string",
                "minLength": 1
              },
              "models": {
                "type": "object",
                "minProperties": 1,
                "additionalProperties": {
                  "type": "object",
                  "additionalProperties": false,
                  "required": [
                    "path"
                  ],
                  "properties": {
                    "path": {
                      "type": "string",
                      "minLength": 1
                    },
                    "vision": {
                      "type": "string",
                      "minLength": 1
                    },
                    "context": {
                      "type": "integer",
                      "minimum": 1
                    },
                    "mtp": {
                      "type": "boolean"
                    },
                    "dspark_model": {
                      "type": "string",
                      "minLength": 1
                    },
                    "args": {
                      "type": "array",
                      "items": {
                        "type": "string",
                        "minLength": 1
                      }
                    }
                  }
                }
              },
              "args": {
                "type": "array",
                "items": {
                  "type": "string",
                  "minLength": 1
                }
              },
              "kv_disk_dir": {
                "type": "string",
                "minLength": 1
              },
              "kv_disk_space_mb": {
                "type": "integer",
                "minimum": 1
              }
            },
            "additionalProperties": false
          },
          {
            "type": "object",
            "required": [
              "type",
              "base_url"
            ],
            "properties": {
              "max_concurrency": {
                "type": "integer",
                "minimum": 1
              },
              "prefixes": {
                "type": "array",
                "items": {
                  "type": "string",
                  "minLength": 1
                }
              },
              "discover_models": {
                "type": "boolean"
              },
              "model_list_path": {
                "type": "string",
                "minLength": 1
              },
              "load_url": {
                "type": "string",
                "minLength": 1
              },
              "unload_url": {
                "type": "string",
                "minLength": 1
              },
              "unload_all_url": {
                "type": "string",
                "minLength": 1
              },
              "requires_unload": {
                "type": "boolean"
              },
              "ready_path": {
                "type": "string",
                "minLength": 1
              },
              "model_status_path": {
                "type": [
                  "string",
                  "null"
                ]
              },
              "inject_stream_usage": {
                "type": "boolean"
              },
              "startup_timeout": {
                "type": "number",
                "exclusiveMinimum": 0
              },
              "startup_poll_seconds": {
                "type": "number",
                "exclusiveMinimum": 0
              },
              "unload_timeout": {
                "type": "number",
                "exclusiveMinimum": 0
              },
              "settle_seconds": {
                "type": "number",
                "minimum": 0
              },
              "unload_settle_seconds": {
                "type": "number",
                "minimum": 0
              },
              "load_settle_seconds": {
                "type": "number",
                "minimum": 0
              },
              "model_policies": {
                "type": "object",
                "additionalProperties": {
                  "type": "object",
                  "required": [
                    "max_concurrency"
                  ],
                  "additionalProperties": false,
                  "properties": {
                    "max_concurrency": {
                      "type": "integer",
                      "minimum": 1
                    }
                  }
                }
              },
              "type": {
                "enum": [
                  "omlx"
                ]
              },
              "models": {
                "type": "array",
                "items": {
                  "type": "string",
                  "minLength": 1
                }
              },
              "base_url": {
                "type": "string",
                "minLength": 1
              }
            },
            "additionalProperties": false
          },
          {
            "type": "object",
            "required": [
              "type"
            ],
            "properties": {
              "max_concurrency": {
                "type": "integer",
                "minimum": 1
              },
              "prefixes": {
                "type": "array",
                "items": {
                  "type": "string",
                  "minLength": 1
                }
              },
              "discover_models": {
                "type": "boolean"
              },
              "model_list_path": {
                "type": "string",
                "minLength": 1
              },
              "load_url": {
                "type": "string",
                "minLength": 1
              },
              "unload_url": {
                "type": "string",
                "minLength": 1
              },
              "unload_all_url": {
                "type": "string",
                "minLength": 1
              },
              "requires_unload": {
                "type": "boolean"
              },
              "ready_path": {
                "type": "string",
                "minLength": 1
              },
              "model_status_path": {
                "type": [
                  "string",
                  "null"
                ]
              },
              "inject_stream_usage": {
                "type": "boolean"
              },
              "startup_timeout": {
                "type": "number",
                "exclusiveMinimum": 0
              },
              "startup_poll_seconds": {
                "type": "number",
                "exclusiveMinimum": 0
              },
              "unload_timeout": {
                "type": "number",
                "exclusiveMinimum": 0
              },
              "settle_seconds": {
                "type": "number",
                "minimum": 0
              },
              "unload_settle_seconds": {
                "type": "number",
                "minimum": 0
              },
              "load_settle_seconds": {
                "type": "number",
                "minimum": 0
              },
              "model_policies": {
                "type": "object",
                "additionalProperties": {
                  "type": "object",
                  "required": [
                    "max_concurrency"
                  ],
                  "additionalProperties": false,
                  "properties": {
                    "max_concurrency": {
                      "type": "integer",
                      "minimum": 1
                    }
                  }
                }
              },
              "type": {
                "enum": [
                  "process"
                ]
              },
              "port": {
                "oneOf": [
                  {
                    "enum": [
                      "auto"
                    ]
                  },
                  {
                    "type": "integer",
                    "minimum": 1,
                    "maximum": 65535
                  }
                ]
              },
              "working_dir": {
                "type": "string",
                "minLength": 1
              },
              "env": {
                "type": "object",
                "additionalProperties": {
                  "type": "string"
                }
              },
              "command": {
                "type": "array",
                "items": {
                  "type": "string",
                  "minLength": 1
                }
              },
              "model_commands": {
                "type": "object",
                "additionalProperties": {
                  "type": "array",
                  "items": {
                    "type": "string",
                    "minLength": 1
                  }
                }
              },
              "models": {
                "type": "array",
                "items": {
                  "type": "string",
                  "minLength": 1
                }
              }
            },
            "additionalProperties": false
          },
          {
            "type": "object",
            "required": [
              "type",
              "base_url"
            ],
            "properties": {
              "max_concurrency": {
                "type": "integer",
                "minimum": 1
              },
              "prefixes": {
                "type": "array",
                "items": {
                  "type": "string",
                  "minLength": 1
                }
              },
              "discover_models": {
                "type": "boolean"
              },
              "model_list_path": {
                "type": "string",
                "minLength": 1
              },
              "load_url": {
                "type": "string",
                "minLength": 1
              },
              "unload_url": {
                "type": "string",
                "minLength": 1
              },
              "unload_all_url": {
                "type": "string",
                "minLength": 1
              },
              "requires_unload": {
                "type": "boolean"
              },
              "ready_path": {
                "type": "string",
                "minLength": 1
              },
              "model_status_path": {
                "type": [
                  "string",
                  "null"
                ]
              },
              "inject_stream_usage": {
                "type": "boolean"
              },
              "startup_timeout": {
                "type": "number",
                "exclusiveMinimum": 0
              },
              "startup_poll_seconds": {
                "type": "number",
                "exclusiveMinimum": 0
              },
              "unload_timeout": {
                "type": "number",
                "exclusiveMinimum": 0
              },
              "settle_seconds": {
                "type": "number",
                "minimum": 0
              },
              "unload_settle_seconds": {
                "type": "number",
                "minimum": 0
              },
              "load_settle_seconds": {
                "type": "number",
                "minimum": 0
              },
              "model_policies": {
                "type": "object",
                "additionalProperties": {
                  "type": "object",
                  "required": [
                    "max_concurrency"
                  ],
                  "additionalProperties": false,
                  "properties": {
                    "max_concurrency": {
                      "type": "integer",
                      "minimum": 1
                    }
                  }
                }
              },
              "type": {
                "enum": [
                  "http"
                ]
              },
              "models": {
                "type": "array",
                "items": {
                  "type": "string",
                  "minLength": 1
                }
              },
              "base_url": {
                "type": "string",
                "minLength": 1
              }
            },
            "additionalProperties": false
          }
        ]
      }
    }
  }
}
